{
  "schema_version": "0.1.0",
  "product": "pelaggio",
  "release": "0.1.0",
  "posture": "intent",
  "generated_from": "trust-claims.yml",
  "threat_model_ref": "./threat-model.md",
  "defaults": {
    "ship_target": "pull-request",
    "telemetry": "off",
    "control_plane_auth": "required"
  },
  "capabilities": [
    {
      "id": "repo.read",
      "description": "Read repository files, local configuration, and roadmap context needed to plan or verify work.",
      "default": "allowed",
      "scope": "local_repo_only",
      "approval": "not_required",
      "evidence": [
        "TC-015"
      ]
    },
    {
      "id": "repo.write.worktree",
      "description": "Create/edit files while working an item.",
      "default": "allowed",
      "scope": "item_worktree_only",
      "approval": "not_required",
      "evidence": [
        "TC-011",
        "TC-015"
      ]
    },
    {
      "id": "shell.exec.worktree",
      "description": "Run shell commands while working an item. The high-trust capability; scoped to the worktree and bounded by budget/turn caps.",
      "default": "allowed",
      "scope": "item_worktree_only",
      "approval": "not_required",
      "evidence": [
        "TC-011",
        "TC-015"
      ]
    },
    {
      "id": "pr.open",
      "description": "Open a pull request with the item's work.",
      "default": "allowed",
      "approval": "not_required",
      "evidence": [
        "TC-003",
        "TC-012"
      ]
    },
    {
      "id": "git.push.default_branch",
      "description": "Push directly to the repo's default branch.",
      "default": "denied",
      "approval": "explicit_config_required",
      "evidence": [
        "TC-012"
      ]
    },
    {
      "id": "pr.automerge",
      "description": "Auto-merge a PR once checks pass.",
      "default": "denied",
      "approval": "explicit_config_required",
      "evidence": [
        "TC-013"
      ]
    },
    {
      "id": "control_plane.spawn_run",
      "description": "Spawn an orchestrator run via the control-plane API.",
      "default": "denied",
      "scope": "authenticated",
      "approval": "explicit_config_required",
      "evidence": [
        "TC-010"
      ]
    }
  ],
  "egress": [
    {
      "destination": "anthropic",
      "data_categories": [
        "prompts",
        "repo_paths",
        "source_context",
        "diffs",
        "issue_text"
      ],
      "required": true,
      "retention": "governed by the provider's policy",
      "opt_out": "configure a different model provider when one is supported",
      "role": "sub_processor",
      "evidence": [
        "TC-006"
      ]
    },
    {
      "destination": "openai",
      "data_categories": [
        "prompts",
        "request_bodies",
        "provider_usage"
      ],
      "required": false,
      "retention": "governed by the provider's policy",
      "opt_out": "omit the run-contained egress selection",
      "role": "sub_processor",
      "evidence": [
        "TC-006",
        "TC-017"
      ]
    },
    {
      "destination": "cli-chat-proxy.grok.com",
      "data_categories": [
        "prompts",
        "source_context",
        "read_file_context"
      ],
      "required": false,
      "retention": "governed by the provider's policy",
      "opt_out": "configure a different model provider for the step",
      "role": "sub_processor",
      "evidence": [
        "TC-006",
        "TC-014"
      ]
    },
    {
      "destination": "github",
      "data_categories": [
        "issues",
        "pull_requests",
        "plan_bodies",
        "diffs",
        "comments"
      ],
      "required": false,
      "retention": "your GitHub",
      "opt_out": "use a different roadmap adapter",
      "role": "user_controlled_endpoint",
      "evidence": [
        "TC-006",
        "TC-003"
      ]
    },
    {
      "destination": "linear",
      "data_categories": [
        "issues",
        "comments",
        "state"
      ],
      "required": false,
      "retention": "your Linear workspace",
      "opt_out": "use a different roadmap adapter",
      "role": "user_controlled_endpoint",
      "evidence": [
        "TC-006"
      ]
    },
    {
      "destination": "git_remote",
      "data_categories": [
        "commits",
        "branches"
      ],
      "required": false,
      "retention": "your remote",
      "opt_out": "n/a - your own remote",
      "role": "user_controlled_endpoint",
      "evidence": [
        "TC-006",
        "TC-012"
      ]
    },
    {
      "destination": "notify_webhook",
      "data_categories": [
        "outcome_metadata"
      ],
      "required": false,
      "retention": "your endpoint",
      "opt_out": "leave notify.url unset",
      "role": "user_controlled_endpoint",
      "evidence": [
        "TC-006"
      ]
    }
  ],
  "never": [
    {
      "statement": "push to your default branch by default",
      "evidence": [
        "TC-012"
      ]
    },
    {
      "statement": "send telemetry or analytics",
      "evidence": [
        "TC-002"
      ]
    },
    {
      "statement": "interpolate known secret environment variables into prompts or structured run logs",
      "evidence": [
        "TC-001"
      ]
    },
    {
      "statement": "run install scripts from our published package",
      "evidence": [
        "TC-004"
      ]
    },
    {
      "statement": "merge a pull request the review gate did not pass in pull-request mode",
      "evidence": [
        "TC-003",
        "TC-013"
      ]
    }
  ],
  "provenance": {
    "npm_provenance": true,
    "signed_tag": false,
    "sigstore_bundle": "planned",
    "evidence": [
      "TC-005"
    ]
  },
  "permission_tiers": [
    {
      "id": "local_read",
      "description": "Read repository files and local configuration needed to plan or verify work.",
      "default": true,
      "capabilities": [
        "repo.read"
      ],
      "evidence": [
        "TC-015"
      ]
    },
    {
      "id": "worktree_write",
      "description": "Write files and run commands inside the claimed worktree.",
      "default": true,
      "capabilities": [
        "repo.write.worktree",
        "shell.exec.worktree"
      ],
      "evidence": [
        "TC-011",
        "TC-015"
      ]
    },
    {
      "id": "remote_mutation",
      "description": "Open PRs by default; direct push and auto-merge require explicit ship.target opt-in.",
      "default": false,
      "capabilities": [
        "pr.open",
        "git.push.default_branch",
        "pr.automerge"
      ],
      "evidence": [
        "TC-003",
        "TC-012",
        "TC-013"
      ]
    }
  ],
  "sandbox_scope": {
    "worktree_scope": "item worktree by convention and hooks; the post-step audit always gates siblings and gates main by default",
    "main_repo_protection": "default post-step Git-state diff fails on main changes; dirty-main mode uses Claude mutating-tool delta attribution or Codex workspace exclusion while retaining sibling enforcement",
    "planned_hardening": "not an OS/container sandbox: writes to paths outside any tracked git root (e.g. $HOME, /tmp, arbitrary absolute paths) are not caught by this audit and remain bounded by tool/egress scoping (TC-015)",
    "evidence": [
      "TC-011",
      "TC-015",
      "TC-018"
    ]
  },
  "claims_ref": "./trust-claims.yml"
}
